{
  "schema_version": "1.0.0",
  "identifier": "sample.contract",
  "version": "1.2.3",
  "checksum": "sha256:0000000000000000000000000000000000000000000000000000000000000000",
  "path": "generated/config/app.json",
  "secret_ref": {
    "provider": "wechat.pay",
    "key": "MERCHANT_API_KEY",
    "environment": "test"
  },
  "target": "web",
  "delivery_mode": "generated_source"
}
